diseases,symptoms
Allergic Rhinitis,"fatigue, coughing, runny_ stuffy nose, Sneezing, wheezing, postnasal_drip, itchy_throat"
Urinary Tract Infection,"foul_smelling-urine, pelvic_pain, Painful_urination"
Motion Sickness,"Nausea, vomiting, sweating, dizziness"
Thrombophlebitis,"redness_along _vein, warmth_in_affected_area, Pain"
Lactose Intolerance,"nausea, abdominal_cramps, bloating, gas_after_consuming_dairy_products"
Food Poisining,"dehydration, diarrhea, weakness, fever, Nausea, abdominal_cramps, vomiting"
Iron Deficiency,"pale-skin, Fatigue, weakness, dizziness"
Chlamydia,"abnormal_vaginal_discharge, penile_discharge, pelvic_pain, pain_during_intercourse"
Nosebleeds(Epistaxis),"dizziness , Bleeding_nostrils, lightheadedness"
Influenza(Flu),"diarrhea, muscle_pain, Fever, sore_throat, sometimes_vomiting, cough, fatigue, headache"
Acute Bronchitis,"mucus, shortness_of_breath, Cough, wheezing, chest_discomfort"
Irritable Bowel Syndrome,"constipation, bloating, changes_in_bowel_habits, gas, cramping, diarrhea, Abdominal_pain"
Blepharitis,"flaking_skin, swollen_eyelids, burning_sensation, crusting_along_the_eyelashes"
Styes,"pain, increased_tearing, sensation_in_the_eye, tenderness, Red,_swollen_lump_on_eyelid"
Tonsilitis,"swollen_lymph_nodes, bad_breath, Sore_throat, difficulty_swallowing, swollen_tonsils, fever"
Psoriasis,"thickened_pitted_nails, swollen_joints, itching_burning_sensations, covered_with_thick, silvery scales, Red_patches_of_skin"
Varicose Veins,"Bulging, heaviness, swelling, twisted_veins"
Hives(Urticaria),"itchy_welts_on_skin, burning_stinging_sensations"
